7/3/2020 16:35:52,Ms.,20,Malaysia,Have studied,No Background,Gain further understanding in how to use python and how to apply it to data science,Food & Beverages,Jewellery & Accessories,Hobbies & Books
7/3/2020 16:36:41,Mr.,21,Singapore,Have studied,No Background,Hope to pick up new skills,Computers & Peripherals,Mobile & Gadgets,Food & Beverages
7/3/2020 16:55:28,Ms.,20,Singapore,"Have studied, Have used in a project",Have studied,Gain knowledge,Mobile & Gadgets,Women's Apparel,Beauty & Personal Care
7/3/2020 17:02:04,Mr.,31,Taiwai,Have studied,No Background,Know more about  Data Science ,Computers & Peripherals,Food & Beverages,Video Games
7/3/2020 17:50:03,Mr.,24,Thailand,No Background,No Background,More understanding about principle and structure of the language. Then apply to the projects,Hobbies & Books,Mobile & Gadgets,Video Games
7/3/2020 17:54:30,Ms.,23,Taiwai,No Background,Have studied,Analyze data with python ,Women's Apparel,Beauty & Personal Care,Computers & Peripherals
7/3/2020 18:05:30,Mr.,29,Singapore,Have studied,Have studied,Deepen knowledge,Computers & Peripherals,Hobbies & Books,Mobile & Gadgets
7/3/2020 19:01:22,Mr.,23,Singapore,No Background,No Background,learn as much as i can,Hobbies & Books,Mobile & Gadgets,Computers & Peripherals
7/3/2020 19:27:36,Ms.,37,Malaysia,Have studied,Have used in a project,Learning,Beauty & Personal Care,Computers & Peripherals,Hobbies & Books
7/3/2020 19:34:32,Mr.,22,Singapore,Have studied,No Background,Learning how to code with Python. ,Mobile & Gadgets,Hobbies & Books,Men's Wear
7/3/2020 19:38:46,Ms.,25,Vietnam,Have studied,No Background,Python fundamental for Data Science,Video Games,Computers & Peripherals,Watches
7/3/2020 21:19:56,Mr.,20,Vietnam,Have studied,Have studied,To gain new knowledge,Computers & Peripherals,Beauty & Personal Care,Hobbies & Books
7/3/2020 22:59:07,Mr.,23,Singapore,Have used in a project,No Background,To learn the fundamentals of data science,Men's Wear,Food & Beverages,Computers & Peripherals
7/4/2020 7:28:15,Mr.,26,Malaysia,Have studied,Have studied,Explore new thing,Computers & Peripherals,Food & Beverages,Hobbies & Books
7/4/2020 9:49:19,Mr.,22,Indonesia,Have used in a project,Have used in a project,Learn more about machine learning with python,Computers & Peripherals,Jewellery & Accessories,Computers & Peripherals
7/4/2020 10:46:37,Mr.,23,Singapore,Have studied,No Background,Learn more about python for data science,Computers & Peripherals,Hobbies & Books,Mobile & Gadgets
7/4/2020 11:20:05,Ms.,47,Singapore,Have studied,No Background,Hope to advance my skills,Mobile & Gadgets,Hobbies & Books,Computers & Peripherals
7/4/2020 11:28:29,Mr.,28,China,Have used in a project,Have used in a project,learn more ML ,Video Games,Hobbies & Books,Mobile & Gadgets
7/4/2020 12:10:58,Ms.,29,Philippines,Have studied,Have studied,Understand Numpy and Panda. And learn it's actual application in data science,Food & Beverages,Women's Apparel,Beauty & Personal Care
7/4/2020 12:58:29,Ms.,24,Malaysia,Have studied,No Background,Increase understanding about data science,Hobbies & Books,Beauty & Personal Care,Jewellery & Accessories
7/4/2020 13:01:02,Ms.,19,Philippines,Regularly use at work,Regularly use at work,I will learn how to use python for data science,Women's Apparel,Mobile & Gadgets,Computers & Peripherals
7/4/2020 13:14:32,Ms.,20,Singapore,No Background,No Background,Learn basics of python,Women's Apparel,Mobile & Gadgets,Beauty & Personal Care
7/4/2020 13:42:44,Mr.,25,Indonesia,Have used in a project,Have studied,increase knowledge,Computers & Peripherals,Hobbies & Books,Mobile & Gadgets
7/4/2020 14:19:17,Ms.,20,Indonesia,Regularly use at work,Have used in a project,"I want to learn more about data science, especially for the application of numpy and pandas library in it.",Beauty & Personal Care,Food & Beverages,Video Games
7/4/2020 18:28:16,Ms.,20,Singapore,Have studied,No Background,Learn a new skill that can be applied,Beauty & Personal Care,Women's Apparel,Food & Beverages
7/4/2020 18:51:53,Ms.,21,Singapore,Have studied,No Background,Know more about numpy and pandas for data science ,Women's Apparel,Hobbies & Books,Beauty & Personal Care
7/5/2020 11:54:06,Ms.,20,Singapore,No Background,No Background,learn as much as i can,Hobbies & Books,Mobile & Gadgets,Food & Beverages
7/5/2020 12:09:23,Ms.,25,Indonesia,Have studied,No Background,Form a solid foundation on learning data science ,Beauty & Personal Care,Food & Beverages,Hobbies & Books
7/5/2020 13:43:36,Mr.,50,Singapore,"Have studied, Have used in a project","Have studied, Have used in a project",Learn immediate python,Food & Beverages,Women's Apparel,Video Games
7/5/2020 13:47:30,Mr.,21,Malaysia,Have studied,Have studied,know more about data science,Computers & Peripherals,Mobile & Gadgets,Video Games
7/5/2020 14:13:45,Mr.,50,Singapore,"Have studied, Have used in a project","Have studied, Have used in a project",Learn immediate python,Food & Beverages,Women's Apparel,Video Games
7/5/2020 14:14:42,Ms.,22,Taiwai,Have used in a project,Have studied,To have  a better idea in How it works in Python and data ,Hobbies & Books,Beauty & Personal Care,Women's Apparel
7/5/2020 14:24:58,Ms.,24,Taiwan,Have used in a project,No Background,agility between Numpy and Pandas,Beauty & Personal Care,Food & Beverages,Women's Apparel
7/5/2020 16:07:19,Mr.,21,Malaysia,No Background,No Background,To learn how to write scripts in python ,Men's Wear,Hobbies & Books,Food & Beverages
7/5/2020 18:04:25,Ms.,30,Indonesia,Have used in a project,Have used in a project,Learn python for data science,Food & Beverages,Beauty & Personal Care,Hobbies & Books
7/5/2020 20:57:21,Ms.,21,Singapore,Have studied,Have used in a project,Knowing more about Python and Numpy for data transformation,Women's Apparel,Beauty & Personal Care,Mobile & Gadgets
7/6/2020 7:43:49,Mr.,13,Singapore,Have used in a project,Have studied,-,Computers & Peripherals,Men's Wear,Mobile & Gadgets
7/6/2020 8:55:18,Mr.,22,Singapore,Have studied,No Background,learn more about how python is used for ds,Hobbies & Books,Men's Wear,Food & Beverages